[
  {"protocol_version": 1, "type": "register", "frame_id": "frm-register-001", "sent_at": "2026-07-15T00:00:00Z", "payload": {"worker_id": "wrk-support-001", "sdk_version": "1.0.0", "capabilities": {"tool_dispatch": true}, "max_in_flight": 4}, "frame_hmac": "00"},
  {"protocol_version": 1, "type": "dispatch", "frame_id": "frm-dispatch-001", "sent_at": "2026-07-15T00:00:01Z", "payload": {"dispatch": {"schema_version": 1, "dispatch_id": "dsp-001", "attempt_id": "att-001", "attempt": 1, "organization_id": "org-support", "project_id": "prj-support", "agent_id": "agt-support", "agent_version": 2, "execution_mode": "worker", "session_id": "ses-001", "call_id": "call-001", "tool_id": "tool-lookup-case", "tool_name": "lookup_case", "arguments": {"case_id": "case-1001"}, "idempotency": "idempotent", "timeout_ms": 5000, "created_at": "2026-07-15T00:00:00Z", "deadline_at": "2026-07-15T00:00:05Z", "response_mode": "sync"}}, "frame_hmac": "00"},
  {"protocol_version": 1, "type": "tool_result", "frame_id": "frm-result-001", "sent_at": "2026-07-15T00:00:02Z", "payload": {"callback": {"schema_version": 1, "dispatch_id": "dsp-001", "attempt_id": "att-001", "session_id": "ses-001", "call_id": "call-001", "completed_at": "2026-07-15T00:00:02Z", "outcome": {"call_id": "call-001", "status": "ok", "duration_ms": 1, "result": {"priority": "high"}}}}, "frame_hmac": "00"}
]
